{"assignment_id":"external-af00422557e8eb5bf06b99dfde8c6777d23f8af5c8f760d6bcbc853d2699f486-reviewer","base_commit_sha":"4fe7ea495965abbd871c2f1b199601debc57458c","created_at":"2026-09-01T17:33:50.757933Z","created_by_profile_id":"codex-control-v1","protocol":"helios.build.external-session-assignment/v1","provider":"CODEX","role":"REVIEWER","routing_action":"EXTERNAL_SESSION_ASSIGN","routing_reason":"EXTERNAL_SESSION_SELECTED","session_id":"codex-div23-registry-reviewer-20260901-01","target_host_eligible":false,"task_manifest_sha256":"af00422557e8eb5bf06b99dfde8c6777d23f8af5c8f760d6bcbc853d2699f486","transport":"EXTERNAL_SESSION","worker_profile_id":"codex-reviewer-v1","worker_profile_sha256":"7e2442dd99447f4f30b3d22e1363a9369c1675a76b0d3b3f2021f6f00611c8f3"}