{"assignment_id":"external-8efeed58f367f6984fea4fe3d33c41e27599246011eed26c99219e04caa58979-builder","base_commit_sha":"df33f084c496ab02ac599e0c560350f00e5ecf00","created_at":"2026-09-01T17:57:49.073061Z","created_by_profile_id":"codex-control-v1","protocol":"helios.build.external-session-assignment/v1","provider":"CODEX","role":"BUILDER","routing_action":"EXTERNAL_SESSION_ASSIGN","routing_reason":"EXTERNAL_SESSION_SELECTED","session_id":"codex-athena-r1a-builder-20260901-01","target_host_eligible":false,"task_manifest_sha256":"8efeed58f367f6984fea4fe3d33c41e27599246011eed26c99219e04caa58979","transport":"EXTERNAL_SESSION","worker_profile_id":"codex-builder-v1","worker_profile_sha256":"06aa3f19f8343a0bc289b5558bf881e978e360e872050058e3b4310464a99561"}