{"assignment_id":"external-54cf68822cc8e4f42a0f2e095ee8be55854f51a594bfd1fd9d93e188fd83b164-reviewer","base_commit_sha":"6535fb2e99ae3f148c867433c2c610d863930e22","created_at":"2026-09-01T19:03:39.877279Z","created_by_profile_id":"codex-control-v1","protocol":"helios.build.external-session-assignment/v1","provider":"CODEX","role":"REVIEWER","routing_action":"EXTERNAL_SESSION_ASSIGN","routing_reason":"EXTERNAL_SESSION_SELECTED","session_id":"codex-div23-calculation-kernel-reviewer-20260901-01","target_host_eligible":false,"task_manifest_sha256":"54cf68822cc8e4f42a0f2e095ee8be55854f51a594bfd1fd9d93e188fd83b164","transport":"EXTERNAL_SESSION","worker_profile_id":"codex-reviewer-v1","worker_profile_sha256":"7e2442dd99447f4f30b3d22e1363a9369c1675a76b0d3b3f2021f6f00611c8f3"}