{"assignment_id":"external-54cf68822cc8e4f42a0f2e095ee8be55854f51a594bfd1fd9d93e188fd83b164-builder","base_commit_sha":"6535fb2e99ae3f148c867433c2c610d863930e22","created_at":"2026-09-01T18:33:28.048610Z","created_by_profile_id":"codex-control-v1","protocol":"helios.build.external-session-assignment/v1","provider":"CODEX","role":"BUILDER","routing_action":"EXTERNAL_SESSION_ASSIGN","routing_reason":"EXTERNAL_SESSION_SELECTED","session_id":"codex-div23-calculation-kernel-builder-20260901-01","target_host_eligible":false,"task_manifest_sha256":"54cf68822cc8e4f42a0f2e095ee8be55854f51a594bfd1fd9d93e188fd83b164","transport":"EXTERNAL_SESSION","worker_profile_id":"codex-builder-v1","worker_profile_sha256":"06aa3f19f8343a0bc289b5558bf881e978e360e872050058e3b4310464a99561"}