{"assignment_id":"external-d7818473288fea00e14aa44c99d6b05077375edf317c7e772e093028804c9117-reviewer","base_commit_sha":"6535fb2e99ae3f148c867433c2c610d863930e22","created_at":"2026-09-01T19:24:06.136288Z","created_by_profile_id":"codex-control-v1","protocol":"helios.build.external-session-assignment/v1","provider":"CODEX","role":"REVIEWER","routing_action":"EXTERNAL_SESSION_ASSIGN","routing_reason":"EXTERNAL_SESSION_SELECTED","session_id":"codex-div23-calculation-kernel-correction-reviewer-20260901-01","target_host_eligible":false,"task_manifest_sha256":"d7818473288fea00e14aa44c99d6b05077375edf317c7e772e093028804c9117","transport":"EXTERNAL_SESSION","worker_profile_id":"codex-reviewer-v1","worker_profile_sha256":"7e2442dd99447f4f30b3d22e1363a9369c1675a76b0d3b3f2021f6f00611c8f3"}