{"assignment_id":"external-af00422557e8eb5bf06b99dfde8c6777d23f8af5c8f760d6bcbc853d2699f486-builder","base_commit_sha":"4fe7ea495965abbd871c2f1b199601debc57458c","created_at":"2026-09-01T17:22:10.533056Z","created_by_profile_id":"codex-control-v1","protocol":"helios.build.external-session-assignment/v1","provider":"CODEX","role":"BUILDER","routing_action":"EXTERNAL_SESSION_ASSIGN","routing_reason":"EXTERNAL_SESSION_SELECTED","session_id":"codex-div23-registry-builder-20260901-01","target_host_eligible":false,"task_manifest_sha256":"af00422557e8eb5bf06b99dfde8c6777d23f8af5c8f760d6bcbc853d2699f486","transport":"EXTERNAL_SESSION","worker_profile_id":"codex-builder-v1","worker_profile_sha256":"06aa3f19f8343a0bc289b5558bf881e978e360e872050058e3b4310464a99561"}