{"assignment_id":"external-3993b8d0bfa76bd18b49b0054d868f073e5404cebcfccd60e4c5565ce0a8f0e9-builder","base_commit_sha":"5b4c1472edf296d3f4a9c3ea35bddfebdd7ebf8f","created_at":"2026-09-01T17:03:44.806098Z","created_by_profile_id":"codex-control-v1","protocol":"helios.build.external-session-assignment/v1","provider":"CODEX","role":"BUILDER","routing_action":"EXTERNAL_SESSION_ASSIGN","routing_reason":"EXTERNAL_SESSION_SELECTED","session_id":"codex-task9c-builder-20260901-01","target_host_eligible":false,"task_manifest_sha256":"3993b8d0bfa76bd18b49b0054d868f073e5404cebcfccd60e4c5565ce0a8f0e9","transport":"EXTERNAL_SESSION","worker_profile_id":"codex-builder-v1","worker_profile_sha256":"06aa3f19f8343a0bc289b5558bf881e978e360e872050058e3b4310464a99561"}