{"assignment_id":"external-4d86abcf67e37d724b8def4ac1e4682f7d90a131a75fd3ff9997ab7161e90835-builder","base_commit_sha":"8ac56eba20004e4a93866b11e8e3b97ae7da8869","created_at":"2026-09-01T18:03:35.824677Z","created_by_profile_id":"codex-control-v1","protocol":"helios.build.external-session-assignment/v1","provider":"CODEX","role":"BUILDER","routing_action":"EXTERNAL_SESSION_ASSIGN","routing_reason":"EXTERNAL_SESSION_SELECTED","session_id":"codex-div23-registry-hardening-builder-20260901-01","target_host_eligible":false,"task_manifest_sha256":"4d86abcf67e37d724b8def4ac1e4682f7d90a131a75fd3ff9997ab7161e90835","transport":"EXTERNAL_SESSION","worker_profile_id":"codex-builder-v1","worker_profile_sha256":"06aa3f19f8343a0bc289b5558bf881e978e360e872050058e3b4310464a99561"}