{"assignment_id":"external-3993b8d0bfa76bd18b49b0054d868f073e5404cebcfccd60e4c5565ce0a8f0e9-reviewer","base_commit_sha":"5b4c1472edf296d3f4a9c3ea35bddfebdd7ebf8f","created_at":"2026-09-01T17:10:11.986709Z","created_by_profile_id":"codex-control-v1","protocol":"helios.build.external-session-assignment/v1","provider":"CODEX","role":"REVIEWER","routing_action":"EXTERNAL_SESSION_ASSIGN","routing_reason":"EXTERNAL_SESSION_SELECTED","session_id":"codex-task9c-reviewer-20260901-01","target_host_eligible":false,"task_manifest_sha256":"3993b8d0bfa76bd18b49b0054d868f073e5404cebcfccd60e4c5565ce0a8f0e9","transport":"EXTERNAL_SESSION","worker_profile_id":"codex-reviewer-v1","worker_profile_sha256":"7e2442dd99447f4f30b3d22e1363a9369c1675a76b0d3b3f2021f6f00611c8f3"}