{"assignment_id":"external-c1c0e67a963c90985a5dae08fead23ed1e204e8a5cc51148e7abe11d54ba9c4f-builder","base_commit_sha":"d6bbc7b0ccc96bdc7f9692dcc5f8928cd6145172","created_at":"2026-09-01T16:45:46.431879Z","created_by_profile_id":"codex-control-v1","protocol":"helios.build.external-session-assignment/v1","provider":"CODEX","role":"BUILDER","routing_action":"EXTERNAL_SESSION_ASSIGN","routing_reason":"EXTERNAL_SESSION_SELECTED","session_id":"codex-task9r1-builder-20260901-01","target_host_eligible":false,"task_manifest_sha256":"c1c0e67a963c90985a5dae08fead23ed1e204e8a5cc51148e7abe11d54ba9c4f","transport":"EXTERNAL_SESSION","worker_profile_id":"codex-builder-v1","worker_profile_sha256":"06aa3f19f8343a0bc289b5558bf881e978e360e872050058e3b4310464a99561"}