{"assignment_id":"external-d7818473288fea00e14aa44c99d6b05077375edf317c7e772e093028804c9117-builder","base_commit_sha":"6535fb2e99ae3f148c867433c2c610d863930e22","created_at":"2026-09-01T19:13:30.296837Z","created_by_profile_id":"codex-control-v1","protocol":"helios.build.external-session-assignment/v1","provider":"CODEX","role":"BUILDER","routing_action":"EXTERNAL_SESSION_ASSIGN","routing_reason":"EXTERNAL_SESSION_SELECTED","session_id":"codex-div23-calculation-kernel-correction-builder-20260901-01","target_host_eligible":false,"task_manifest_sha256":"d7818473288fea00e14aa44c99d6b05077375edf317c7e772e093028804c9117","transport":"EXTERNAL_SESSION","worker_profile_id":"codex-builder-v1","worker_profile_sha256":"06aa3f19f8343a0bc289b5558bf881e978e360e872050058e3b4310464a99561"}