{"assignment_id":"external-c1c0e67a963c90985a5dae08fead23ed1e204e8a5cc51148e7abe11d54ba9c4f-reviewer","base_commit_sha":"d6bbc7b0ccc96bdc7f9692dcc5f8928cd6145172","created_at":"2026-09-01T16:52:46.676276Z","created_by_profile_id":"codex-control-v1","protocol":"helios.build.external-session-assignment/v1","provider":"CODEX","role":"REVIEWER","routing_action":"EXTERNAL_SESSION_ASSIGN","routing_reason":"EXTERNAL_SESSION_SELECTED","session_id":"codex-task9r1-reviewer-20260901-01","target_host_eligible":false,"task_manifest_sha256":"c1c0e67a963c90985a5dae08fead23ed1e204e8a5cc51148e7abe11d54ba9c4f","transport":"EXTERNAL_SESSION","worker_profile_id":"codex-reviewer-v1","worker_profile_sha256":"7e2442dd99447f4f30b3d22e1363a9369c1675a76b0d3b3f2021f6f00611c8f3"}