{"assignment_id":"external-8efeed58f367f6984fea4fe3d33c41e27599246011eed26c99219e04caa58979-reviewer","base_commit_sha":"df33f084c496ab02ac599e0c560350f00e5ecf00","created_at":"2026-09-01T18:15:36.458158Z","created_by_profile_id":"codex-control-v1","protocol":"helios.build.external-session-assignment/v1","provider":"CODEX","role":"REVIEWER","routing_action":"EXTERNAL_SESSION_ASSIGN","routing_reason":"EXTERNAL_SESSION_SELECTED","session_id":"codex-athena-r1a-reviewer-20260901-01","target_host_eligible":false,"task_manifest_sha256":"8efeed58f367f6984fea4fe3d33c41e27599246011eed26c99219e04caa58979","transport":"EXTERNAL_SESSION","worker_profile_id":"codex-reviewer-v1","worker_profile_sha256":"7e2442dd99447f4f30b3d22e1363a9369c1675a76b0d3b3f2021f6f00611c8f3"}