{"assignment_id":"external-009fb2a8b371c83a089f25573e2818043f9dd7b18377b54fa73663c28a265fec-builder","base_commit_sha":"4fe7ea495965abbd871c2f1b199601debc57458c","created_at":"2026-09-01T17:41:09.050804Z","created_by_profile_id":"codex-control-v1","protocol":"helios.build.external-session-assignment/v1","provider":"CODEX","role":"BUILDER","routing_action":"EXTERNAL_SESSION_ASSIGN","routing_reason":"EXTERNAL_SESSION_SELECTED","session_id":"codex-div23-registry-correction-builder-20260901-01","target_host_eligible":false,"task_manifest_sha256":"009fb2a8b371c83a089f25573e2818043f9dd7b18377b54fa73663c28a265fec","transport":"EXTERNAL_SESSION","worker_profile_id":"codex-builder-v1","worker_profile_sha256":"06aa3f19f8343a0bc289b5558bf881e978e360e872050058e3b4310464a99561"}