{"assignment_id":"external-bc197ed65c19119a9a66fca50e7ea03dc5f266f67ffb0e448abf6919b8d3b56a-reviewer","base_commit_sha":"6972551269bcb3d42d2c60c63d326cd6befac356","created_at":"2026-09-01T16:37:43.777491Z","created_by_profile_id":"codex-control-v1","protocol":"helios.build.external-session-assignment/v1","provider":"CODEX","role":"REVIEWER","routing_action":"EXTERNAL_SESSION_ASSIGN","routing_reason":"EXTERNAL_SESSION_SELECTED","session_id":"codex-task9-reviewer-20260901-01","target_host_eligible":false,"task_manifest_sha256":"bc197ed65c19119a9a66fca50e7ea03dc5f266f67ffb0e448abf6919b8d3b56a","transport":"EXTERNAL_SESSION","worker_profile_id":"codex-reviewer-v1","worker_profile_sha256":"7e2442dd99447f4f30b3d22e1363a9369c1675a76b0d3b3f2021f6f00611c8f3"}